[I 2024-05-08 18:53:23,959] Trial 56 finished with value: 0.7260378691863446 and parameters: {'num_neuronios': 14, 'num_camadas': 2, 'ativacao': 'leaky_relu', 'learning_rate': 0.003174571150153687, 'optimizer': 'rmsprop'}. Best is trial 13 with value: 0.7236846093386838.
GPU available: True (cuda), used: True
TPU available: False, using: 0 TPU cores
IPU available: False, using: 0 IPUs
HPU available: False, using: 0 HPUs
LOCAL_RANK: 0 - CUDA_VISIBLE_DEVICES: [0]

  | Name | Type       | Params
------------------------------------
0 | rede | Sequential | 241   
------------------------------------
241       Trainable params
0         Non-trainable params
241       Total params
0.001     Total estimated model params size (MB)
SLURM auto-requeueing enabled. Setting signal handlers.
`Trainer.fit` stopped: `max_epochs=50` reached.
/home/gustavo23000/anaconda3/envs/rapid/lib/python3.10/site-packages/sklearn/metrics/_regression.py:483: FutureWarning: 'squared' is deprecated in version 1.4 and will be removed in 1.6. To calculate the root mean squared error, use the function'root_mean_squared_error'.
  warnings.warn(
[I 2024-05-08 18:54:51,187] Trial 57 finished with value: 0.7343902620329102 and parameters: {'num_neuronios': 12, 'num_camadas': 2, 'ativacao': 'tanh', 'learning_rate': 0.0005939486630296775, 'optimizer': 'rmsprop'}. Best is trial 13 with value: 0.7236846093386838.
GPU available: True (cuda), used: True
TPU available: False, using: 0 TPU cores
IPU available: False, using: 0 IPUs
HPU available: False, using: 0 HPUs
LOCAL_RANK: 0 - CUDA_VISIBLE_DEVICES: [0]

  | Name | Type       | Params
------------------------------------
0 | rede | Sequential | 309   
------------------------------------
309       Trainable params
0         Non-trainable params
309       Total params
0.001     Total estimated model params size (MB)
SLURM auto-requeueing enabled. Setting signal handlers.
`Trainer.fit` stopped: `max_epochs=50` reached.
/home/gustavo23000/anaconda3/envs/rapid/lib/python3.10/site-packages/sklearn/metrics/_regression.py:483: FutureWarning: 'squared' is deprecated in version 1.4 and will be removed in 1.6. To calculate the root mean squared error, use the function'root_mean_squared_error'.
  warnings.warn(
[I 2024-05-08 18:56:18,442] Trial 58 finished with value: 0.7338585368219062 and parameters: {'num_neuronios': 14, 'num_camadas': 2, 'ativacao': 'sigmoid', 'learning_rate': 0.003446117274560226, 'optimizer': 'rmsprop'}. Best is trial 13 with value: 0.7236846093386838.
GPU available: True (cuda), used: True
TPU available: False, using: 0 TPU cores
IPU available: False, using: 0 IPUs
HPU available: False, using: 0 HPUs
LOCAL_RANK: 0 - CUDA_VISIBLE_DEVICES: [0]

  | Name | Type       | Params
------------------------------------
0 | rede | Sequential | 274   
------------------------------------
274       Trainable params
0         Non-trainable params
274       Total params
0.001     Total estimated model params size (MB)
SLURM auto-requeueing enabled. Setting signal handlers.
`Trainer.fit` stopped: `max_epochs=50` reached.
/home/gustavo23000/anaconda3/envs/rapid/lib/python3.10/site-packages/sklearn/metrics/_regression.py:483: FutureWarning: 'squared' is deprecated in version 1.4 and will be removed in 1.6. To calculate the root mean squared error, use the function'root_mean_squared_error'.
  warnings.warn(
[I 2024-05-08 18:57:44,871] Trial 59 finished with value: 0.7294872500769721 and parameters: {'num_neuronios': 13, 'num_camadas': 2, 'ativacao': 'leaky_relu', 'learning_rate': 0.0011469859018097058, 'optimizer': 'rmsprop'}. Best is trial 13 with value: 0.7236846093386838.
GPU available: True (cuda), used: True
TPU available: False, using: 0 TPU cores
IPU available: False, using: 0 IPUs
HPU available: False, using: 0 HPUs
LOCAL_RANK: 0 - CUDA_VISIBLE_DEVICES: [0]

  | Name | Type       | Params
------------------------------------
0 | rede | Sequential | 106   
------------------------------------
106       Trainable params
0         Non-trainable params
106       Total params
0.000     Total estimated model params size (MB)
SLURM auto-requeueing enabled. Setting signal handlers.
`Trainer.fit` stopped: `max_epochs=50` reached.
/home/gustavo23000/anaconda3/envs/rapid/lib/python3.10/site-packages/sklearn/metrics/_regression.py:483: FutureWarning: 'squared' is deprecated in version 1.4 and will be removed in 1.6. To calculate the root mean squared error, use the function'root_mean_squared_error'.
  warnings.warn(
[I 2024-05-08 18:59:10,321] Trial 60 finished with value: 0.7335314849687812 and parameters: {'num_neuronios': 7, 'num_camadas': 2, 'ativacao': 'leaky_relu', 'learning_rate': 0.0020904283039706304, 'optimizer': 'rmsprop'}. Best is trial 13 with value: 0.7236846093386838.
GPU available: True (cuda), used: True
TPU available: False, using: 0 TPU cores
IPU available: False, using: 0 IPUs
HPU available: False, using: 0 HPUs
LOCAL_RANK: 0 - CUDA_VISIBLE_DEVICES: [0]

  | Name | Type       | Params
------------------------------------
0 | rede | Sequential | 385   
------------------------------------
385       Trainable params
0         Non-trainable params
385       Total params
0.002     Total estimated model params size (MB)
SLURM auto-requeueing enabled. Setting signal handlers.
`Trainer.fit` stopped: `max_epochs=50` reached.
/home/gustavo23000/anaconda3/envs/rapid/lib/python3.10/site-packages/sklearn/metrics/_regression.py:483: FutureWarning: 'squared' is deprecated in version 1.4 and will be removed in 1.6. To calculate the root mean squared error, use the function'root_mean_squared_error'.
  warnings.warn(
[I 2024-05-08 19:00:35,202] Trial 61 finished with value: 0.7270957093440031 and parameters: {'num_neuronios': 16, 'num_camadas': 2, 'ativacao': 'leaky_relu', 'learning_rate': 0.008457917450620196, 'optimizer': 'rmsprop'}. Best is trial 13 with value: 0.7236846093386838.
GPU available: True (cuda), used: True
TPU available: False, using: 0 TPU cores
IPU available: False, using: 0 IPUs
HPU available: False, using: 0 HPUs
LOCAL_RANK: 0 - CUDA_VISIBLE_DEVICES: [0]

  | Name | Type       | Params
------------------------------------
0 | rede | Sequential | 346   
------------------------------------
346       Trainable params
0         Non-trainable params
346       Total params
0.001     Total estimated model params size (MB)
SLURM auto-requeueing enabled. Setting signal handlers.
`Trainer.fit` stopped: `max_epochs=50` reached.
/home/gustavo23000/anaconda3/envs/rapid/lib/python3.10/site-packages/sklearn/metrics/_regression.py:483: FutureWarning: 'squared' is deprecated in version 1.4 and will be removed in 1.6. To calculate the root mean squared error, use the function'root_mean_squared_error'.
  warnings.warn(
[I 2024-05-08 19:01:58,072] Trial 62 finished with value: 0.7272228670073559 and parameters: {'num_neuronios': 15, 'num_camadas': 2, 'ativacao': 'leaky_relu', 'learning_rate': 0.0052523023214138325, 'optimizer': 'rmsprop'}. Best is trial 13 with value: 0.7236846093386838.
GPU available: True (cuda), used: True
TPU available: False, using: 0 TPU cores
IPU available: False, using: 0 IPUs
HPU available: False, using: 0 HPUs
LOCAL_RANK: 0 - CUDA_VISIBLE_DEVICES: [0]

  | Name | Type       | Params
------------------------------------
0 | rede | Sequential | 309   
------------------------------------
309       Trainable params
0         Non-trainable params
309       Total params
0.001     Total estimated model params size (MB)
SLURM auto-requeueing enabled. Setting signal handlers.
`Trainer.fit` stopped: `max_epochs=50` reached.
/home/gustavo23000/anaconda3/envs/rapid/lib/python3.10/site-packages/sklearn/metrics/_regression.py:483: FutureWarning: 'squared' is deprecated in version 1.4 and will be removed in 1.6. To calculate the root mean squared error, use the function'root_mean_squared_error'.
  warnings.warn(
[I 2024-05-08 19:03:23,771] Trial 63 finished with value: 0.7263688148725923 and parameters: {'num_neuronios': 14, 'num_camadas': 2, 'ativacao': 'leaky_relu', 'learning_rate': 0.0032334760739648133, 'optimizer': 'rmsprop'}. Best is trial 13 with value: 0.7236846093386838.
GPU available: True (cuda), used: True
TPU available: False, using: 0 TPU cores
IPU available: False, using: 0 IPUs
HPU available: False, using: 0 HPUs
LOCAL_RANK: 0 - CUDA_VISIBLE_DEVICES: [0]

  | Name | Type       | Params
------------------------------------
0 | rede | Sequential | 274   
------------------------------------
274       Trainable params
0         Non-trainable params
274       Total params
0.001     Total estimated model params size (MB)
SLURM auto-requeueing enabled. Setting signal handlers.
`Trainer.fit` stopped: `max_epochs=50` reached.
/home/gustavo23000/anaconda3/envs/rapid/lib/python3.10/site-packages/sklearn/metrics/_regression.py:483: FutureWarning: 'squared' is deprecated in version 1.4 and will be removed in 1.6. To calculate the root mean squared error, use the function'root_mean_squared_error'.
  warnings.warn(
[I 2024-05-08 19:04:49,450] Trial 64 finished with value: 0.726965477201973 and parameters: {'num_neuronios': 13, 'num_camadas': 2, 'ativacao': 'leaky_relu', 'learning_rate': 0.0019620551686410697, 'optimizer': 'rmsprop'}. Best is trial 13 with value: 0.7236846093386838.
GPU available: True (cuda), used: True
TPU available: False, using: 0 TPU cores
IPU available: False, using: 0 IPUs
HPU available: False, using: 0 HPUs
LOCAL_RANK: 0 - CUDA_VISIBLE_DEVICES: [0]

  | Name | Type       | Params
------------------------------------
0 | rede | Sequential | 309   
------------------------------------
309       Trainable params
0         Non-trainable params
309       Total params
0.001     Total estimated model params size (MB)
SLURM auto-requeueing enabled. Setting signal handlers.
`Trainer.fit` stopped: `max_epochs=50` reached.
/home/gustavo23000/anaconda3/envs/rapid/lib/python3.10/site-packages/sklearn/metrics/_regression.py:483: FutureWarning: 'squared' is deprecated in version 1.4 and will be removed in 1.6. To calculate the root mean squared error, use the function'root_mean_squared_error'.
  warnings.warn(
[I 2024-05-08 19:06:13,584] Trial 65 finished with value: 0.7256509604227687 and parameters: {'num_neuronios': 14, 'num_camadas': 2, 'ativacao': 'leaky_relu', 'learning_rate': 0.003053412777062772, 'optimizer': 'rmsprop'}. Best is trial 13 with value: 0.7236846093386838.
GPU available: True (cuda), used: True
TPU available: False, using: 0 TPU cores
IPU available: False, using: 0 IPUs
HPU available: False, using: 0 HPUs
LOCAL_RANK: 0 - CUDA_VISIBLE_DEVICES: [0]

  | Name | Type       | Params
------------------------------------
0 | rede | Sequential | 309   
------------------------------------
309       Trainable params
0         Non-trainable params
309       Total params
0.001     Total estimated model params size (MB)
SLURM auto-requeueing enabled. Setting signal handlers.
`Trainer.fit` stopped: `max_epochs=50` reached.
/home/gustavo23000/anaconda3/envs/rapid/lib/python3.10/site-packages/sklearn/metrics/_regression.py:483: FutureWarning: 'squared' is deprecated in version 1.4 and will be removed in 1.6. To calculate the root mean squared error, use the function'root_mean_squared_error'.
  warnings.warn(
[I 2024-05-08 19:07:43,650] Trial 66 finished with value: 0.8929924779716626 and parameters: {'num_neuronios': 14, 'num_camadas': 2, 'ativacao': 'leaky_relu', 'learning_rate': 0.0012347988340813123, 'optimizer': 'sgd'}. Best is trial 13 with value: 0.7236846093386838.
GPU available: True (cuda), used: True
TPU available: False, using: 0 TPU cores
IPU available: False, using: 0 IPUs
HPU available: False, using: 0 HPUs
LOCAL_RANK: 0 - CUDA_VISIBLE_DEVICES: [0]

  | Name | Type       | Params
------------------------------------
0 | rede | Sequential | 85    
------------------------------------
85        Trainable params
0         Non-trainable params
85        Total params
0.000     Total estimated model params size (MB)
SLURM auto-requeueing enabled. Setting signal handlers.
`Trainer.fit` stopped: `max_epochs=50` reached.
/home/gustavo23000/anaconda3/envs/rapid/lib/python3.10/site-packages/sklearn/metrics/_regression.py:483: FutureWarning: 'squared' is deprecated in version 1.4 and will be removed in 1.6. To calculate the root mean squared error, use the function'root_mean_squared_error'.
  warnings.warn(
[I 2024-05-08 19:09:09,815] Trial 67 finished with value: 0.736048802098285 and parameters: {'num_neuronios': 12, 'num_camadas': 1, 'ativacao': 'tanh', 'learning_rate': 0.0008510226280258679, 'optimizer': 'rmsprop'}. Best is trial 13 with value: 0.7236846093386838.
GPU available: True (cuda), used: True
TPU available: False, using: 0 TPU cores
IPU available: False, using: 0 IPUs
HPU available: False, using: 0 HPUs
LOCAL_RANK: 0 - CUDA_VISIBLE_DEVICES: [0]

  | Name | Type       | Params
------------------------------------
0 | rede | Sequential | 274   
------------------------------------
274       Trainable params
0         Non-trainable params
274       Total params
0.001     Total estimated model params size (MB)
SLURM auto-requeueing enabled. Setting signal handlers.
`Trainer.fit` stopped: `max_epochs=50` reached.
/home/gustavo23000/anaconda3/envs/rapid/lib/python3.10/site-packages/sklearn/metrics/_regression.py:483: FutureWarning: 'squared' is deprecated in version 1.4 and will be removed in 1.6. To calculate the root mean squared error, use the function'root_mean_squared_error'.
  warnings.warn(
[I 2024-05-08 19:10:38,551] Trial 68 finished with value: 0.726459646100987 and parameters: {'num_neuronios': 13, 'num_camadas': 2, 'ativacao': 'leaky_relu', 'learning_rate': 0.0040895880645598695, 'optimizer': 'adam'}. Best is trial 13 with value: 0.7236846093386838.
GPU available: True (cuda), used: True
TPU available: False, using: 0 TPU cores
IPU available: False, using: 0 IPUs
HPU available: False, using: 0 HPUs
LOCAL_RANK: 0 - CUDA_VISIBLE_DEVICES: [0]

  | Name | Type       | Params
------------------------------------
0 | rede | Sequential | 181   
------------------------------------
181       Trainable params
0         Non-trainable params
181       Total params
0.001     Total estimated model params size (MB)
SLURM auto-requeueing enabled. Setting signal handlers.
`Trainer.fit` stopped: `max_epochs=50` reached.
/home/gustavo23000/anaconda3/envs/rapid/lib/python3.10/site-packages/sklearn/metrics/_regression.py:483: FutureWarning: 'squared' is deprecated in version 1.4 and will be removed in 1.6. To calculate the root mean squared error, use the function'root_mean_squared_error'.
  warnings.warn(
[I 2024-05-08 19:12:05,645] Trial 69 finished with value: 0.7320870725152394 and parameters: {'num_neuronios': 10, 'num_camadas': 2, 'ativacao': 'relu', 'learning_rate': 0.0028836539157895834, 'optimizer': 'rmsprop'}. Best is trial 13 with value: 0.7236846093386838.
GPU available: True (cuda), used: True
TPU available: False, using: 0 TPU cores
IPU available: False, using: 0 IPUs
HPU available: False, using: 0 HPUs
LOCAL_RANK: 0 - CUDA_VISIBLE_DEVICES: [0]

  | Name | Type       | Params
------------------------------------
0 | rede | Sequential | 210   
------------------------------------
210       Trainable params
0         Non-trainable params
210       Total params
0.001     Total estimated model params size (MB)
SLURM auto-requeueing enabled. Setting signal handlers.
`Trainer.fit` stopped: `max_epochs=50` reached.
/home/gustavo23000/anaconda3/envs/rapid/lib/python3.10/site-packages/sklearn/metrics/_regression.py:483: FutureWarning: 'squared' is deprecated in version 1.4 and will be removed in 1.6. To calculate the root mean squared error, use the function'root_mean_squared_error'.
  warnings.warn(
[I 2024-05-08 19:13:33,774] Trial 70 finished with value: 0.7319446735677548 and parameters: {'num_neuronios': 11, 'num_camadas': 2, 'ativacao': 'leaky_relu', 'learning_rate': 0.00033415675778088476, 'optimizer': 'rmsprop'}. Best is trial 13 with value: 0.7236846093386838.
GPU available: True (cuda), used: True
TPU available: False, using: 0 TPU cores
IPU available: False, using: 0 IPUs
HPU available: False, using: 0 HPUs
LOCAL_RANK: 0 - CUDA_VISIBLE_DEVICES: [0]

  | Name | Type       | Params
------------------------------------
0 | rede | Sequential | 309   
------------------------------------
309       Trainable params
0         Non-trainable params
309       Total params
0.001     Total estimated model params size (MB)
SLURM auto-requeueing enabled. Setting signal handlers.
`Trainer.fit` stopped: `max_epochs=50` reached.
/home/gustavo23000/anaconda3/envs/rapid/lib/python3.10/site-packages/sklearn/metrics/_regression.py:483: FutureWarning: 'squared' is deprecated in version 1.4 and will be removed in 1.6. To calculate the root mean squared error, use the function'root_mean_squared_error'.
  warnings.warn(
[I 2024-05-08 19:15:01,943] Trial 71 finished with value: 0.7306014277612048 and parameters: {'num_neuronios': 14, 'num_camadas': 2, 'ativacao': 'leaky_relu', 'learning_rate': 0.003018498952929274, 'optimizer': 'rmsprop'}. Best is trial 13 with value: 0.7236846093386838.
GPU available: True (cuda), used: True
TPU available: False, using: 0 TPU cores
IPU available: False, using: 0 IPUs
HPU available: False, using: 0 HPUs
LOCAL_RANK: 0 - CUDA_VISIBLE_DEVICES: [0]

  | Name | Type       | Params
------------------------------------
0 | rede | Sequential | 346   
------------------------------------
346       Trainable params
0         Non-trainable params
346       Total params
0.001     Total estimated model params size (MB)
SLURM auto-requeueing enabled. Setting signal handlers.
`Trainer.fit` stopped: `max_epochs=50` reached.
/home/gustavo23000/anaconda3/envs/rapid/lib/python3.10/site-packages/sklearn/metrics/_regression.py:483: FutureWarning: 'squared' is deprecated in version 1.4 and will be removed in 1.6. To calculate the root mean squared error, use the function'root_mean_squared_error'.
  warnings.warn(
[I 2024-05-08 19:16:26,465] Trial 72 finished with value: 0.7279801637675019 and parameters: {'num_neuronios': 15, 'num_camadas': 2, 'ativacao': 'leaky_relu', 'learning_rate': 0.0017931857161855487, 'optimizer': 'rmsprop'}. Best is trial 13 with value: 0.7236846093386838.
GPU available: True (cuda), used: True
TPU available: False, using: 0 TPU cores
IPU available: False, using: 0 IPUs
HPU available: False, using: 0 HPUs
LOCAL_RANK: 0 - CUDA_VISIBLE_DEVICES: [0]

  | Name | Type       | Params
------------------------------------
0 | rede | Sequential | 309   
------------------------------------
309       Trainable params
0         Non-trainable params
309       Total params
0.001     Total estimated model params size (MB)
SLURM auto-requeueing enabled. Setting signal handlers.
`Trainer.fit` stopped: `max_epochs=50` reached.
/home/gustavo23000/anaconda3/envs/rapid/lib/python3.10/site-packages/sklearn/metrics/_regression.py:483: FutureWarning: 'squared' is deprecated in version 1.4 and will be removed in 1.6. To calculate the root mean squared error, use the function'root_mean_squared_error'.
  warnings.warn(
[I 2024-05-08 19:17:56,556] Trial 73 finished with value: 0.7297943680381973 and parameters: {'num_neuronios': 14, 'num_camadas': 2, 'ativacao': 'leaky_relu', 'learning_rate': 0.000632590037045944, 'optimizer': 'rmsprop'}. Best is trial 13 with value: 0.7236846093386838.
GPU available: True (cuda), used: True
TPU available: False, using: 0 TPU cores
IPU available: False, using: 0 IPUs
HPU available: False, using: 0 HPUs
LOCAL_RANK: 0 - CUDA_VISIBLE_DEVICES: [0]

  | Name | Type       | Params
------------------------------------
0 | rede | Sequential | 346   
------------------------------------
346       Trainable params
0         Non-trainable params
346       Total params
0.001     Total estimated model params size (MB)
SLURM auto-requeueing enabled. Setting signal handlers.
`Trainer.fit` stopped: `max_epochs=50` reached.
/home/gustavo23000/anaconda3/envs/rapid/lib/python3.10/site-packages/sklearn/metrics/_regression.py:483: FutureWarning: 'squared' is deprecated in version 1.4 and will be removed in 1.6. To calculate the root mean squared error, use the function'root_mean_squared_error'.
  warnings.warn(
[I 2024-05-08 19:19:26,526] Trial 74 finished with value: 0.7316444207844858 and parameters: {'num_neuronios': 15, 'num_camadas': 2, 'ativacao': 'leaky_relu', 'learning_rate': 0.009979895878334616, 'optimizer': 'rmsprop'}. Best is trial 13 with value: 0.7236846093386838.
GPU available: True (cuda), used: True
TPU available: False, using: 0 TPU cores
IPU available: False, using: 0 IPUs
HPU available: False, using: 0 HPUs
LOCAL_RANK: 0 - CUDA_VISIBLE_DEVICES: [0]

  | Name | Type       | Params
------------------------------------
0 | rede | Sequential | 274   
------------------------------------
274       Trainable params
0         Non-trainable params
274       Total params
0.001     Total estimated model params size (MB)
SLURM auto-requeueing enabled. Setting signal handlers.
`Trainer.fit` stopped: `max_epochs=50` reached.
/home/gustavo23000/anaconda3/envs/rapid/lib/python3.10/site-packages/sklearn/metrics/_regression.py:483: FutureWarning: 'squared' is deprecated in version 1.4 and will be removed in 1.6. To calculate the root mean squared error, use the function'root_mean_squared_error'.
  warnings.warn(
