[I 2024-05-08 17:57:54,618] Trial 18 finished with value: 0.7294348545266558 and parameters: {'num_neuronios': 13, 'num_camadas': 3, 'ativacao': 'leaky_relu', 'learning_rate': 0.0010772852576257641, 'optimizer': 'rmsprop'}. Best is trial 13 with value: 0.7236846093386838.
GPU available: True (cuda), used: True
TPU available: False, using: 0 TPU cores
IPU available: False, using: 0 IPUs
HPU available: False, using: 0 HPUs
LOCAL_RANK: 0 - CUDA_VISIBLE_DEVICES: [0]

  | Name | Type       | Params
------------------------------------
0 | rede | Sequential | 385   
------------------------------------
385       Trainable params
0         Non-trainable params
385       Total params
0.002     Total estimated model params size (MB)
SLURM auto-requeueing enabled. Setting signal handlers.
`Trainer.fit` stopped: `max_epochs=50` reached.
/home/gustavo23000/anaconda3/envs/rapid/lib/python3.10/site-packages/sklearn/metrics/_regression.py:483: FutureWarning: 'squared' is deprecated in version 1.4 and will be removed in 1.6. To calculate the root mean squared error, use the function'root_mean_squared_error'.
  warnings.warn(
[I 2024-05-08 17:59:23,153] Trial 19 finished with value: 0.8573324538957611 and parameters: {'num_neuronios': 16, 'num_camadas': 2, 'ativacao': 'leaky_relu', 'learning_rate': 0.008658852596418819, 'optimizer': 'sgd'}. Best is trial 13 with value: 0.7236846093386838.
GPU available: True (cuda), used: True
TPU available: False, using: 0 TPU cores
IPU available: False, using: 0 IPUs
HPU available: False, using: 0 HPUs
LOCAL_RANK: 0 - CUDA_VISIBLE_DEVICES: [0]

  | Name | Type       | Params
------------------------------------
0 | rede | Sequential | 346   
------------------------------------
346       Trainable params
0         Non-trainable params
346       Total params
0.001     Total estimated model params size (MB)
SLURM auto-requeueing enabled. Setting signal handlers.
`Trainer.fit` stopped: `max_epochs=50` reached.
/home/gustavo23000/anaconda3/envs/rapid/lib/python3.10/site-packages/sklearn/metrics/_regression.py:483: FutureWarning: 'squared' is deprecated in version 1.4 and will be removed in 1.6. To calculate the root mean squared error, use the function'root_mean_squared_error'.
  warnings.warn(
[I 2024-05-08 18:00:47,266] Trial 20 finished with value: 0.7338428746672452 and parameters: {'num_neuronios': 15, 'num_camadas': 2, 'ativacao': 'leaky_relu', 'learning_rate': 0.00016139572961655955, 'optimizer': 'rmsprop'}. Best is trial 13 with value: 0.7236846093386838.
GPU available: True (cuda), used: True
TPU available: False, using: 0 TPU cores
IPU available: False, using: 0 IPUs
HPU available: False, using: 0 HPUs
LOCAL_RANK: 0 - CUDA_VISIBLE_DEVICES: [0]

  | Name | Type       | Params
------------------------------------
0 | rede | Sequential | 385   
------------------------------------
385       Trainable params
0         Non-trainable params
385       Total params
0.002     Total estimated model params size (MB)
SLURM auto-requeueing enabled. Setting signal handlers.
`Trainer.fit` stopped: `max_epochs=50` reached.
/home/gustavo23000/anaconda3/envs/rapid/lib/python3.10/site-packages/sklearn/metrics/_regression.py:483: FutureWarning: 'squared' is deprecated in version 1.4 and will be removed in 1.6. To calculate the root mean squared error, use the function'root_mean_squared_error'.
  warnings.warn(
[I 2024-05-08 18:02:14,726] Trial 21 finished with value: 0.7272140401436265 and parameters: {'num_neuronios': 16, 'num_camadas': 2, 'ativacao': 'leaky_relu', 'learning_rate': 0.0014855948658142664, 'optimizer': 'rmsprop'}. Best is trial 13 with value: 0.7236846093386838.
GPU available: True (cuda), used: True
TPU available: False, using: 0 TPU cores
IPU available: False, using: 0 IPUs
HPU available: False, using: 0 HPUs
LOCAL_RANK: 0 - CUDA_VISIBLE_DEVICES: [0]

  | Name | Type       | Params
------------------------------------
0 | rede | Sequential | 346   
------------------------------------
346       Trainable params
0         Non-trainable params
346       Total params
0.001     Total estimated model params size (MB)
SLURM auto-requeueing enabled. Setting signal handlers.
`Trainer.fit` stopped: `max_epochs=50` reached.
/home/gustavo23000/anaconda3/envs/rapid/lib/python3.10/site-packages/sklearn/metrics/_regression.py:483: FutureWarning: 'squared' is deprecated in version 1.4 and will be removed in 1.6. To calculate the root mean squared error, use the function'root_mean_squared_error'.
  warnings.warn(
[I 2024-05-08 18:03:43,165] Trial 22 finished with value: 0.7299516283318813 and parameters: {'num_neuronios': 15, 'num_camadas': 2, 'ativacao': 'leaky_relu', 'learning_rate': 0.013284311334374826, 'optimizer': 'rmsprop'}. Best is trial 13 with value: 0.7236846093386838.
GPU available: True (cuda), used: True
TPU available: False, using: 0 TPU cores
IPU available: False, using: 0 IPUs
HPU available: False, using: 0 HPUs
LOCAL_RANK: 0 - CUDA_VISIBLE_DEVICES: [0]

  | Name | Type       | Params
------------------------------------
0 | rede | Sequential | 456   
------------------------------------
456       Trainable params
0         Non-trainable params
456       Total params
0.002     Total estimated model params size (MB)
SLURM auto-requeueing enabled. Setting signal handlers.
`Trainer.fit` stopped: `max_epochs=50` reached.
/home/gustavo23000/anaconda3/envs/rapid/lib/python3.10/site-packages/sklearn/metrics/_regression.py:483: FutureWarning: 'squared' is deprecated in version 1.4 and will be removed in 1.6. To calculate the root mean squared error, use the function'root_mean_squared_error'.
  warnings.warn(
[I 2024-05-08 18:05:13,934] Trial 23 finished with value: 0.7272049908124602 and parameters: {'num_neuronios': 13, 'num_camadas': 3, 'ativacao': 'leaky_relu', 'learning_rate': 0.0023999655297429396, 'optimizer': 'rmsprop'}. Best is trial 13 with value: 0.7236846093386838.
GPU available: True (cuda), used: True
TPU available: False, using: 0 TPU cores
IPU available: False, using: 0 IPUs
HPU available: False, using: 0 HPUs
LOCAL_RANK: 0 - CUDA_VISIBLE_DEVICES: [0]

  | Name | Type       | Params
------------------------------------
0 | rede | Sequential | 456   
------------------------------------
456       Trainable params
0         Non-trainable params
456       Total params
0.002     Total estimated model params size (MB)
SLURM auto-requeueing enabled. Setting signal handlers.
`Trainer.fit` stopped: `max_epochs=50` reached.
/home/gustavo23000/anaconda3/envs/rapid/lib/python3.10/site-packages/sklearn/metrics/_regression.py:483: FutureWarning: 'squared' is deprecated in version 1.4 and will be removed in 1.6. To calculate the root mean squared error, use the function'root_mean_squared_error'.
  warnings.warn(
[I 2024-05-08 18:06:40,437] Trial 24 finished with value: 0.7313195761841826 and parameters: {'num_neuronios': 13, 'num_camadas': 3, 'ativacao': 'tanh', 'learning_rate': 0.002405345619256978, 'optimizer': 'rmsprop'}. Best is trial 13 with value: 0.7236846093386838.
GPU available: True (cuda), used: True
TPU available: False, using: 0 TPU cores
IPU available: False, using: 0 IPUs
HPU available: False, using: 0 HPUs
LOCAL_RANK: 0 - CUDA_VISIBLE_DEVICES: [0]

  | Name | Type       | Params
------------------------------------
0 | rede | Sequential | 456   
------------------------------------
456       Trainable params
0         Non-trainable params
456       Total params
0.002     Total estimated model params size (MB)
SLURM auto-requeueing enabled. Setting signal handlers.
`Trainer.fit` stopped: `max_epochs=50` reached.
/home/gustavo23000/anaconda3/envs/rapid/lib/python3.10/site-packages/sklearn/metrics/_regression.py:483: FutureWarning: 'squared' is deprecated in version 1.4 and will be removed in 1.6. To calculate the root mean squared error, use the function'root_mean_squared_error'.
  warnings.warn(
[I 2024-05-08 18:08:11,299] Trial 25 finished with value: 0.7283313170699741 and parameters: {'num_neuronios': 13, 'num_camadas': 3, 'ativacao': 'relu', 'learning_rate': 0.009469178539797389, 'optimizer': 'rmsprop'}. Best is trial 13 with value: 0.7236846093386838.
GPU available: True (cuda), used: True
TPU available: False, using: 0 TPU cores
IPU available: False, using: 0 IPUs
HPU available: False, using: 0 HPUs
LOCAL_RANK: 0 - CUDA_VISIBLE_DEVICES: [0]

  | Name | Type       | Params
------------------------------------
0 | rede | Sequential | 397   
------------------------------------
397       Trainable params
0         Non-trainable params
397       Total params
0.002     Total estimated model params size (MB)
SLURM auto-requeueing enabled. Setting signal handlers.
`Trainer.fit` stopped: `max_epochs=50` reached.
/home/gustavo23000/anaconda3/envs/rapid/lib/python3.10/site-packages/sklearn/metrics/_regression.py:483: FutureWarning: 'squared' is deprecated in version 1.4 and will be removed in 1.6. To calculate the root mean squared error, use the function'root_mean_squared_error'.
  warnings.warn(
[I 2024-05-08 18:09:42,584] Trial 26 finished with value: 0.7305742665312372 and parameters: {'num_neuronios': 12, 'num_camadas': 3, 'ativacao': 'leaky_relu', 'learning_rate': 0.0005919658634342108, 'optimizer': 'rmsprop'}. Best is trial 13 with value: 0.7236846093386838.
GPU available: True (cuda), used: True
TPU available: False, using: 0 TPU cores
IPU available: False, using: 0 IPUs
HPU available: False, using: 0 HPUs
LOCAL_RANK: 0 - CUDA_VISIBLE_DEVICES: [0]

  | Name | Type       | Params
------------------------------------
0 | rede | Sequential | 586   
------------------------------------
586       Trainable params
0         Non-trainable params
586       Total params
0.002     Total estimated model params size (MB)
SLURM auto-requeueing enabled. Setting signal handlers.
`Trainer.fit` stopped: `max_epochs=50` reached.
/home/gustavo23000/anaconda3/envs/rapid/lib/python3.10/site-packages/sklearn/metrics/_regression.py:483: FutureWarning: 'squared' is deprecated in version 1.4 and will be removed in 1.6. To calculate the root mean squared error, use the function'root_mean_squared_error'.
  warnings.warn(
[I 2024-05-08 18:11:11,239] Trial 27 finished with value: 0.7275526310533087 and parameters: {'num_neuronios': 15, 'num_camadas': 3, 'ativacao': 'leaky_relu', 'learning_rate': 0.004548836073734402, 'optimizer': 'rmsprop'}. Best is trial 13 with value: 0.7236846093386838.
GPU available: True (cuda), used: True
TPU available: False, using: 0 TPU cores
IPU available: False, using: 0 IPUs
HPU available: False, using: 0 HPUs
LOCAL_RANK: 0 - CUDA_VISIBLE_DEVICES: [0]

  | Name | Type       | Params
------------------------------------
0 | rede | Sequential | 586   
------------------------------------
586       Trainable params
0         Non-trainable params
586       Total params
0.002     Total estimated model params size (MB)
SLURM auto-requeueing enabled. Setting signal handlers.
`Trainer.fit` stopped: `max_epochs=50` reached.
/home/gustavo23000/anaconda3/envs/rapid/lib/python3.10/site-packages/sklearn/metrics/_regression.py:483: FutureWarning: 'squared' is deprecated in version 1.4 and will be removed in 1.6. To calculate the root mean squared error, use the function'root_mean_squared_error'.
  warnings.warn(
[I 2024-05-08 18:12:40,634] Trial 28 finished with value: 0.8987054476535833 and parameters: {'num_neuronios': 15, 'num_camadas': 3, 'ativacao': 'leaky_relu', 'learning_rate': 0.0001850606708980887, 'optimizer': 'sgd'}. Best is trial 13 with value: 0.7236846093386838.
GPU available: True (cuda), used: True
TPU available: False, using: 0 TPU cores
IPU available: False, using: 0 IPUs
HPU available: False, using: 0 HPUs
LOCAL_RANK: 0 - CUDA_VISIBLE_DEVICES: [0]

  | Name | Type       | Params
------------------------------------
0 | rede | Sequential | 397   
------------------------------------
397       Trainable params
0         Non-trainable params
397       Total params
0.002     Total estimated model params size (MB)
SLURM auto-requeueing enabled. Setting signal handlers.
`Trainer.fit` stopped: `max_epochs=50` reached.
/home/gustavo23000/anaconda3/envs/rapid/lib/python3.10/site-packages/sklearn/metrics/_regression.py:483: FutureWarning: 'squared' is deprecated in version 1.4 and will be removed in 1.6. To calculate the root mean squared error, use the function'root_mean_squared_error'.
  warnings.warn(
[I 2024-05-08 18:14:13,485] Trial 29 finished with value: 0.7263047080974901 and parameters: {'num_neuronios': 12, 'num_camadas': 3, 'ativacao': 'tanh', 'learning_rate': 0.022192504300802884, 'optimizer': 'adam'}. Best is trial 13 with value: 0.7236846093386838.
GPU available: True (cuda), used: True
TPU available: False, using: 0 TPU cores
IPU available: False, using: 0 IPUs
HPU available: False, using: 0 HPUs
LOCAL_RANK: 0 - CUDA_VISIBLE_DEVICES: [0]

  | Name | Type       | Params
------------------------------------
0 | rede | Sequential | 342   
------------------------------------
342       Trainable params
0         Non-trainable params
342       Total params
0.001     Total estimated model params size (MB)
SLURM auto-requeueing enabled. Setting signal handlers.
`Trainer.fit` stopped: `max_epochs=50` reached.
/home/gustavo23000/anaconda3/envs/rapid/lib/python3.10/site-packages/sklearn/metrics/_regression.py:483: FutureWarning: 'squared' is deprecated in version 1.4 and will be removed in 1.6. To calculate the root mean squared error, use the function'root_mean_squared_error'.
  warnings.warn(
[I 2024-05-08 18:15:43,422] Trial 30 finished with value: 0.7306974882689217 and parameters: {'num_neuronios': 11, 'num_camadas': 3, 'ativacao': 'tanh', 'learning_rate': 0.016525439113843216, 'optimizer': 'adam'}. Best is trial 13 with value: 0.7236846093386838.
GPU available: True (cuda), used: True
TPU available: False, using: 0 TPU cores
IPU available: False, using: 0 IPUs
HPU available: False, using: 0 HPUs
LOCAL_RANK: 0 - CUDA_VISIBLE_DEVICES: [0]

  | Name | Type       | Params
------------------------------------
0 | rede | Sequential | 456   
------------------------------------
456       Trainable params
0         Non-trainable params
456       Total params
0.002     Total estimated model params size (MB)
SLURM auto-requeueing enabled. Setting signal handlers.
`Trainer.fit` stopped: `max_epochs=50` reached.
/home/gustavo23000/anaconda3/envs/rapid/lib/python3.10/site-packages/sklearn/metrics/_regression.py:483: FutureWarning: 'squared' is deprecated in version 1.4 and will be removed in 1.6. To calculate the root mean squared error, use the function'root_mean_squared_error'.
  warnings.warn(
[I 2024-05-08 18:17:17,546] Trial 31 finished with value: 0.7283399494641993 and parameters: {'num_neuronios': 13, 'num_camadas': 3, 'ativacao': 'tanh', 'learning_rate': 0.01648871405254189, 'optimizer': 'adam'}. Best is trial 13 with value: 0.7236846093386838.
GPU available: True (cuda), used: True
TPU available: False, using: 0 TPU cores
IPU available: False, using: 0 IPUs
HPU available: False, using: 0 HPUs
LOCAL_RANK: 0 - CUDA_VISIBLE_DEVICES: [0]

  | Name | Type       | Params
------------------------------------
0 | rede | Sequential | 397   
------------------------------------
397       Trainable params
0         Non-trainable params
397       Total params
0.002     Total estimated model params size (MB)
SLURM auto-requeueing enabled. Setting signal handlers.
`Trainer.fit` stopped: `max_epochs=50` reached.
/home/gustavo23000/anaconda3/envs/rapid/lib/python3.10/site-packages/sklearn/metrics/_regression.py:483: FutureWarning: 'squared' is deprecated in version 1.4 and will be removed in 1.6. To calculate the root mean squared error, use the function'root_mean_squared_error'.
  warnings.warn(
[I 2024-05-08 18:18:49,786] Trial 32 finished with value: 0.7298106065439011 and parameters: {'num_neuronios': 12, 'num_camadas': 3, 'ativacao': 'tanh', 'learning_rate': 0.0069129214066524095, 'optimizer': 'adam'}. Best is trial 13 with value: 0.7236846093386838.
GPU available: True (cuda), used: True
TPU available: False, using: 0 TPU cores
IPU available: False, using: 0 IPUs
HPU available: False, using: 0 HPUs
LOCAL_RANK: 0 - CUDA_VISIBLE_DEVICES: [0]

  | Name | Type       | Params
------------------------------------
0 | rede | Sequential | 519   
------------------------------------
519       Trainable params
0         Non-trainable params
519       Total params
0.002     Total estimated model params size (MB)
SLURM auto-requeueing enabled. Setting signal handlers.
`Trainer.fit` stopped: `max_epochs=50` reached.
/home/gustavo23000/anaconda3/envs/rapid/lib/python3.10/site-packages/sklearn/metrics/_regression.py:483: FutureWarning: 'squared' is deprecated in version 1.4 and will be removed in 1.6. To calculate the root mean squared error, use the function'root_mean_squared_error'.
  warnings.warn(
[I 2024-05-08 18:20:22,441] Trial 33 finished with value: 0.7310826211736536 and parameters: {'num_neuronios': 14, 'num_camadas': 3, 'ativacao': 'tanh', 'learning_rate': 0.002266752421821335, 'optimizer': 'adam'}. Best is trial 13 with value: 0.7236846093386838.
GPU available: True (cuda), used: True
TPU available: False, using: 0 TPU cores
IPU available: False, using: 0 IPUs
HPU available: False, using: 0 HPUs
LOCAL_RANK: 0 - CUDA_VISIBLE_DEVICES: [0]

  | Name | Type       | Params
------------------------------------
0 | rede | Sequential | 291   
------------------------------------
291       Trainable params
0         Non-trainable params
291       Total params
0.001     Total estimated model params size (MB)
SLURM auto-requeueing enabled. Setting signal handlers.
`Trainer.fit` stopped: `max_epochs=50` reached.
/home/gustavo23000/anaconda3/envs/rapid/lib/python3.10/site-packages/sklearn/metrics/_regression.py:483: FutureWarning: 'squared' is deprecated in version 1.4 and will be removed in 1.6. To calculate the root mean squared error, use the function'root_mean_squared_error'.
  warnings.warn(
[I 2024-05-08 18:21:51,097] Trial 34 finished with value: 0.7340725989431139 and parameters: {'num_neuronios': 10, 'num_camadas': 3, 'ativacao': 'relu', 'learning_rate': 0.09074180207579767, 'optimizer': 'adam'}. Best is trial 13 with value: 0.7236846093386838.
GPU available: True (cuda), used: True
TPU available: False, using: 0 TPU cores
IPU available: False, using: 0 IPUs
HPU available: False, using: 0 HPUs
LOCAL_RANK: 0 - CUDA_VISIBLE_DEVICES: [0]

  | Name | Type       | Params
------------------------------------
0 | rede | Sequential | 241   
------------------------------------
241       Trainable params
0         Non-trainable params
241       Total params
0.001     Total estimated model params size (MB)
SLURM auto-requeueing enabled. Setting signal handlers.
`Trainer.fit` stopped: `max_epochs=50` reached.
/home/gustavo23000/anaconda3/envs/rapid/lib/python3.10/site-packages/sklearn/metrics/_regression.py:483: FutureWarning: 'squared' is deprecated in version 1.4 and will be removed in 1.6. To calculate the root mean squared error, use the function'root_mean_squared_error'.
  warnings.warn(
[I 2024-05-08 18:23:21,903] Trial 35 finished with value: 0.7332619878725836 and parameters: {'num_neuronios': 12, 'num_camadas': 2, 'ativacao': 'tanh', 'learning_rate': 0.028501901853526083, 'optimizer': 'adam'}. Best is trial 13 with value: 0.7236846093386838.
GPU available: True (cuda), used: True
TPU available: False, using: 0 TPU cores
IPU available: False, using: 0 IPUs
HPU available: False, using: 0 HPUs
LOCAL_RANK: 0 - CUDA_VISIBLE_DEVICES: [0]

  | Name | Type       | Params
------------------------------------
0 | rede | Sequential | 586   
------------------------------------
586       Trainable params
0         Non-trainable params
586       Total params
0.002     Total estimated model params size (MB)
SLURM auto-requeueing enabled. Setting signal handlers.
`Trainer.fit` stopped: `max_epochs=50` reached.
/home/gustavo23000/anaconda3/envs/rapid/lib/python3.10/site-packages/sklearn/metrics/_regression.py:483: FutureWarning: 'squared' is deprecated in version 1.4 and will be removed in 1.6. To calculate the root mean squared error, use the function'root_mean_squared_error'.
  warnings.warn(
[I 2024-05-08 18:24:52,460] Trial 36 finished with value: 0.742632441311049 and parameters: {'num_neuronios': 15, 'num_camadas': 3, 'ativacao': 'leaky_relu', 'learning_rate': 0.05546065269635111, 'optimizer': 'adam'}. Best is trial 13 with value: 0.7236846093386838.
GPU available: True (cuda), used: True
TPU available: False, using: 0 TPU cores
IPU available: False, using: 0 IPUs
HPU available: False, using: 0 HPUs
LOCAL_RANK: 0 - CUDA_VISIBLE_DEVICES: [0]

  | Name | Type       | Params
------------------------------------
0 | rede | Sequential | 64    
------------------------------------
64        Trainable params
0         Non-trainable params
64        Total params
0.000     Total estimated model params size (MB)
SLURM auto-requeueing enabled. Setting signal handlers.
`Trainer.fit` stopped: `max_epochs=50` reached.
/home/gustavo23000/anaconda3/envs/rapid/lib/python3.10/site-packages/sklearn/metrics/_regression.py:483: FutureWarning: 'squared' is deprecated in version 1.4 and will be removed in 1.6. To calculate the root mean squared error, use the function'root_mean_squared_error'.
  warnings.warn(
