[I 2024-05-08 18:26:13,837] Trial 37 finished with value: 0.7319303870446907 and parameters: {'num_neuronios': 9, 'num_camadas': 1, 'ativacao': 'leaky_relu', 'learning_rate': 0.011489665499026885, 'optimizer': 'rmsprop'}. Best is trial 13 with value: 0.7236846093386838.
GPU available: True (cuda), used: True
TPU available: False, using: 0 TPU cores
IPU available: False, using: 0 IPUs
HPU available: False, using: 0 HPUs
LOCAL_RANK: 0 - CUDA_VISIBLE_DEVICES: [0]

  | Name | Type       | Params
------------------------------------
0 | rede | Sequential | 210   
------------------------------------
210       Trainable params
0         Non-trainable params
210       Total params
0.001     Total estimated model params size (MB)
SLURM auto-requeueing enabled. Setting signal handlers.
`Trainer.fit` stopped: `max_epochs=50` reached.
/home/gustavo23000/anaconda3/envs/rapid/lib/python3.10/site-packages/sklearn/metrics/_regression.py:483: FutureWarning: 'squared' is deprecated in version 1.4 and will be removed in 1.6. To calculate the root mean squared error, use the function'root_mean_squared_error'.
  warnings.warn(
[I 2024-05-08 18:27:43,696] Trial 38 finished with value: 0.7318393121123669 and parameters: {'num_neuronios': 11, 'num_camadas': 2, 'ativacao': 'relu', 'learning_rate': 0.0009405390336077777, 'optimizer': 'adam'}. Best is trial 13 with value: 0.7236846093386838.
GPU available: True (cuda), used: True
TPU available: False, using: 0 TPU cores
IPU available: False, using: 0 IPUs
HPU available: False, using: 0 HPUs
LOCAL_RANK: 0 - CUDA_VISIBLE_DEVICES: [0]

  | Name | Type       | Params
------------------------------------
0 | rede | Sequential | 46    
------------------------------------
46        Trainable params
0         Non-trainable params
46        Total params
0.000     Total estimated model params size (MB)
SLURM auto-requeueing enabled. Setting signal handlers.
`Trainer.fit` stopped: `max_epochs=50` reached.
/home/gustavo23000/anaconda3/envs/rapid/lib/python3.10/site-packages/sklearn/metrics/_regression.py:483: FutureWarning: 'squared' is deprecated in version 1.4 and will be removed in 1.6. To calculate the root mean squared error, use the function'root_mean_squared_error'.
  warnings.warn(
[I 2024-05-08 18:29:12,247] Trial 39 finished with value: 0.7335628101820149 and parameters: {'num_neuronios': 3, 'num_camadas': 3, 'ativacao': 'tanh', 'learning_rate': 0.006075499163943757, 'optimizer': 'rmsprop'}. Best is trial 13 with value: 0.7236846093386838.
GPU available: True (cuda), used: True
TPU available: False, using: 0 TPU cores
IPU available: False, using: 0 IPUs
HPU available: False, using: 0 HPUs
LOCAL_RANK: 0 - CUDA_VISIBLE_DEVICES: [0]

  | Name | Type       | Params
------------------------------------
0 | rede | Sequential | 309   
------------------------------------
309       Trainable params
0         Non-trainable params
309       Total params
0.001     Total estimated model params size (MB)
SLURM auto-requeueing enabled. Setting signal handlers.
`Trainer.fit` stopped: `max_epochs=50` reached.
/home/gustavo23000/anaconda3/envs/rapid/lib/python3.10/site-packages/sklearn/metrics/_regression.py:483: FutureWarning: 'squared' is deprecated in version 1.4 and will be removed in 1.6. To calculate the root mean squared error, use the function'root_mean_squared_error'.
  warnings.warn(
[I 2024-05-08 18:30:38,872] Trial 40 finished with value: 0.730399551210708 and parameters: {'num_neuronios': 14, 'num_camadas': 2, 'ativacao': 'leaky_relu', 'learning_rate': 0.020897338367097437, 'optimizer': 'rmsprop'}. Best is trial 13 with value: 0.7236846093386838.
GPU available: True (cuda), used: True
TPU available: False, using: 0 TPU cores
IPU available: False, using: 0 IPUs
HPU available: False, using: 0 HPUs
LOCAL_RANK: 0 - CUDA_VISIBLE_DEVICES: [0]

  | Name | Type       | Params
------------------------------------
0 | rede | Sequential | 385   
------------------------------------
385       Trainable params
0         Non-trainable params
385       Total params
0.002     Total estimated model params size (MB)
SLURM auto-requeueing enabled. Setting signal handlers.
`Trainer.fit` stopped: `max_epochs=50` reached.
/home/gustavo23000/anaconda3/envs/rapid/lib/python3.10/site-packages/sklearn/metrics/_regression.py:483: FutureWarning: 'squared' is deprecated in version 1.4 and will be removed in 1.6. To calculate the root mean squared error, use the function'root_mean_squared_error'.
  warnings.warn(
[I 2024-05-08 18:32:04,602] Trial 41 finished with value: 0.724330162496713 and parameters: {'num_neuronios': 16, 'num_camadas': 2, 'ativacao': 'leaky_relu', 'learning_rate': 0.001526370558068721, 'optimizer': 'rmsprop'}. Best is trial 13 with value: 0.7236846093386838.
GPU available: True (cuda), used: True
TPU available: False, using: 0 TPU cores
IPU available: False, using: 0 IPUs
HPU available: False, using: 0 HPUs
LOCAL_RANK: 0 - CUDA_VISIBLE_DEVICES: [0]

  | Name | Type       | Params
------------------------------------
0 | rede | Sequential | 385   
------------------------------------
385       Trainable params
0         Non-trainable params
385       Total params
0.002     Total estimated model params size (MB)
SLURM auto-requeueing enabled. Setting signal handlers.
`Trainer.fit` stopped: `max_epochs=50` reached.
/home/gustavo23000/anaconda3/envs/rapid/lib/python3.10/site-packages/sklearn/metrics/_regression.py:483: FutureWarning: 'squared' is deprecated in version 1.4 and will be removed in 1.6. To calculate the root mean squared error, use the function'root_mean_squared_error'.
  warnings.warn(
[I 2024-05-08 18:33:29,308] Trial 42 finished with value: 0.729405426298371 and parameters: {'num_neuronios': 16, 'num_camadas': 2, 'ativacao': 'leaky_relu', 'learning_rate': 0.000764354221921611, 'optimizer': 'rmsprop'}. Best is trial 13 with value: 0.7236846093386838.
GPU available: True (cuda), used: True
TPU available: False, using: 0 TPU cores
IPU available: False, using: 0 IPUs
HPU available: False, using: 0 HPUs
LOCAL_RANK: 0 - CUDA_VISIBLE_DEVICES: [0]

  | Name | Type       | Params
------------------------------------
0 | rede | Sequential | 106   
------------------------------------
106       Trainable params
0         Non-trainable params
106       Total params
0.000     Total estimated model params size (MB)
SLURM auto-requeueing enabled. Setting signal handlers.
`Trainer.fit` stopped: `max_epochs=50` reached.
/home/gustavo23000/anaconda3/envs/rapid/lib/python3.10/site-packages/sklearn/metrics/_regression.py:483: FutureWarning: 'squared' is deprecated in version 1.4 and will be removed in 1.6. To calculate the root mean squared error, use the function'root_mean_squared_error'.
  warnings.warn(
[I 2024-05-08 18:34:55,301] Trial 43 finished with value: 0.7288072699588295 and parameters: {'num_neuronios': 15, 'num_camadas': 1, 'ativacao': 'leaky_relu', 'learning_rate': 0.0027778571666203723, 'optimizer': 'rmsprop'}. Best is trial 13 with value: 0.7236846093386838.
GPU available: True (cuda), used: True
TPU available: False, using: 0 TPU cores
IPU available: False, using: 0 IPUs
HPU available: False, using: 0 HPUs
LOCAL_RANK: 0 - CUDA_VISIBLE_DEVICES: [0]

  | Name | Type       | Params
------------------------------------
0 | rede | Sequential | 385   
------------------------------------
385       Trainable params
0         Non-trainable params
385       Total params
0.002     Total estimated model params size (MB)
SLURM auto-requeueing enabled. Setting signal handlers.
`Trainer.fit` stopped: `max_epochs=50` reached.
/home/gustavo23000/anaconda3/envs/rapid/lib/python3.10/site-packages/sklearn/metrics/_regression.py:483: FutureWarning: 'squared' is deprecated in version 1.4 and will be removed in 1.6. To calculate the root mean squared error, use the function'root_mean_squared_error'.
  warnings.warn(
[I 2024-05-08 18:36:21,580] Trial 44 finished with value: 0.7339396066698916 and parameters: {'num_neuronios': 16, 'num_camadas': 2, 'ativacao': 'sigmoid', 'learning_rate': 0.003559077240535168, 'optimizer': 'rmsprop'}. Best is trial 13 with value: 0.7236846093386838.
GPU available: True (cuda), used: True
TPU available: False, using: 0 TPU cores
IPU available: False, using: 0 IPUs
HPU available: False, using: 0 HPUs
LOCAL_RANK: 0 - CUDA_VISIBLE_DEVICES: [0]

  | Name | Type       | Params
------------------------------------
0 | rede | Sequential | 309   
------------------------------------
309       Trainable params
0         Non-trainable params
309       Total params
0.001     Total estimated model params size (MB)
SLURM auto-requeueing enabled. Setting signal handlers.
`Trainer.fit` stopped: `max_epochs=50` reached.
/home/gustavo23000/anaconda3/envs/rapid/lib/python3.10/site-packages/sklearn/metrics/_regression.py:483: FutureWarning: 'squared' is deprecated in version 1.4 and will be removed in 1.6. To calculate the root mean squared error, use the function'root_mean_squared_error'.
  warnings.warn(
[I 2024-05-08 18:37:47,522] Trial 45 finished with value: 0.7251797666976006 and parameters: {'num_neuronios': 14, 'num_camadas': 2, 'ativacao': 'leaky_relu', 'learning_rate': 0.0015697896885185352, 'optimizer': 'rmsprop'}. Best is trial 13 with value: 0.7236846093386838.
GPU available: True (cuda), used: True
TPU available: False, using: 0 TPU cores
IPU available: False, using: 0 IPUs
HPU available: False, using: 0 HPUs
LOCAL_RANK: 0 - CUDA_VISIBLE_DEVICES: [0]

  | Name | Type       | Params
------------------------------------
0 | rede | Sequential | 309   
------------------------------------
309       Trainable params
0         Non-trainable params
309       Total params
0.001     Total estimated model params size (MB)
SLURM auto-requeueing enabled. Setting signal handlers.
`Trainer.fit` stopped: `max_epochs=50` reached.
/home/gustavo23000/anaconda3/envs/rapid/lib/python3.10/site-packages/sklearn/metrics/_regression.py:483: FutureWarning: 'squared' is deprecated in version 1.4 and will be removed in 1.6. To calculate the root mean squared error, use the function'root_mean_squared_error'.
  warnings.warn(
[I 2024-05-08 18:39:13,430] Trial 46 finished with value: 0.8912621048736867 and parameters: {'num_neuronios': 14, 'num_camadas': 2, 'ativacao': 'leaky_relu', 'learning_rate': 0.00029007470889525356, 'optimizer': 'sgd'}. Best is trial 13 with value: 0.7236846093386838.
GPU available: True (cuda), used: True
TPU available: False, using: 0 TPU cores
IPU available: False, using: 0 IPUs
HPU available: False, using: 0 HPUs
LOCAL_RANK: 0 - CUDA_VISIBLE_DEVICES: [0]

  | Name | Type       | Params
------------------------------------
0 | rede | Sequential | 385   
------------------------------------
385       Trainable params
0         Non-trainable params
385       Total params
0.002     Total estimated model params size (MB)
SLURM auto-requeueing enabled. Setting signal handlers.
`Trainer.fit` stopped: `max_epochs=50` reached.
/home/gustavo23000/anaconda3/envs/rapid/lib/python3.10/site-packages/sklearn/metrics/_regression.py:483: FutureWarning: 'squared' is deprecated in version 1.4 and will be removed in 1.6. To calculate the root mean squared error, use the function'root_mean_squared_error'.
  warnings.warn(
[I 2024-05-08 18:40:39,833] Trial 47 finished with value: 0.728906446186677 and parameters: {'num_neuronios': 16, 'num_camadas': 2, 'ativacao': 'sigmoid', 'learning_rate': 0.04684956697233203, 'optimizer': 'rmsprop'}. Best is trial 13 with value: 0.7236846093386838.
GPU available: True (cuda), used: True
TPU available: False, using: 0 TPU cores
IPU available: False, using: 0 IPUs
HPU available: False, using: 0 HPUs
LOCAL_RANK: 0 - CUDA_VISIBLE_DEVICES: [0]

  | Name | Type       | Params
------------------------------------
0 | rede | Sequential | 106   
------------------------------------
106       Trainable params
0         Non-trainable params
106       Total params
0.000     Total estimated model params size (MB)
SLURM auto-requeueing enabled. Setting signal handlers.
`Trainer.fit` stopped: `max_epochs=50` reached.
/home/gustavo23000/anaconda3/envs/rapid/lib/python3.10/site-packages/sklearn/metrics/_regression.py:483: FutureWarning: 'squared' is deprecated in version 1.4 and will be removed in 1.6. To calculate the root mean squared error, use the function'root_mean_squared_error'.
  warnings.warn(
[I 2024-05-08 18:42:03,233] Trial 48 finished with value: 0.7292202488146414 and parameters: {'num_neuronios': 15, 'num_camadas': 1, 'ativacao': 'leaky_relu', 'learning_rate': 0.001400176855922855, 'optimizer': 'rmsprop'}. Best is trial 13 with value: 0.7236846093386838.
GPU available: True (cuda), used: True
TPU available: False, using: 0 TPU cores
IPU available: False, using: 0 IPUs
HPU available: False, using: 0 HPUs
LOCAL_RANK: 0 - CUDA_VISIBLE_DEVICES: [0]

  | Name | Type       | Params
------------------------------------
0 | rede | Sequential | 309   
------------------------------------
309       Trainable params
0         Non-trainable params
309       Total params
0.001     Total estimated model params size (MB)
SLURM auto-requeueing enabled. Setting signal handlers.
`Trainer.fit` stopped: `max_epochs=50` reached.
/home/gustavo23000/anaconda3/envs/rapid/lib/python3.10/site-packages/sklearn/metrics/_regression.py:483: FutureWarning: 'squared' is deprecated in version 1.4 and will be removed in 1.6. To calculate the root mean squared error, use the function'root_mean_squared_error'.
  warnings.warn(
[I 2024-05-08 18:43:27,823] Trial 49 finished with value: 0.896946318896844 and parameters: {'num_neuronios': 14, 'num_camadas': 2, 'ativacao': 'relu', 'learning_rate': 1.148734632604491e-05, 'optimizer': 'adam'}. Best is trial 13 with value: 0.7236846093386838.
GPU available: True (cuda), used: True
TPU available: False, using: 0 TPU cores
IPU available: False, using: 0 IPUs
HPU available: False, using: 0 HPUs
LOCAL_RANK: 0 - CUDA_VISIBLE_DEVICES: [0]

  | Name | Type       | Params
------------------------------------
0 | rede | Sequential | 385   
------------------------------------
385       Trainable params
0         Non-trainable params
385       Total params
0.002     Total estimated model params size (MB)
SLURM auto-requeueing enabled. Setting signal handlers.
`Trainer.fit` stopped: `max_epochs=50` reached.
/home/gustavo23000/anaconda3/envs/rapid/lib/python3.10/site-packages/sklearn/metrics/_regression.py:483: FutureWarning: 'squared' is deprecated in version 1.4 and will be removed in 1.6. To calculate the root mean squared error, use the function'root_mean_squared_error'.
  warnings.warn(
[I 2024-05-08 18:44:54,069] Trial 50 finished with value: 0.7248218329933745 and parameters: {'num_neuronios': 16, 'num_camadas': 2, 'ativacao': 'leaky_relu', 'learning_rate': 0.006121826088168673, 'optimizer': 'rmsprop'}. Best is trial 13 with value: 0.7236846093386838.
GPU available: True (cuda), used: True
TPU available: False, using: 0 TPU cores
IPU available: False, using: 0 IPUs
HPU available: False, using: 0 HPUs
LOCAL_RANK: 0 - CUDA_VISIBLE_DEVICES: [0]

  | Name | Type       | Params
------------------------------------
0 | rede | Sequential | 385   
------------------------------------
385       Trainable params
0         Non-trainable params
385       Total params
0.002     Total estimated model params size (MB)
SLURM auto-requeueing enabled. Setting signal handlers.
`Trainer.fit` stopped: `max_epochs=50` reached.
/home/gustavo23000/anaconda3/envs/rapid/lib/python3.10/site-packages/sklearn/metrics/_regression.py:483: FutureWarning: 'squared' is deprecated in version 1.4 and will be removed in 1.6. To calculate the root mean squared error, use the function'root_mean_squared_error'.
  warnings.warn(
[I 2024-05-08 18:46:17,703] Trial 51 finished with value: 0.7289073366804667 and parameters: {'num_neuronios': 16, 'num_camadas': 2, 'ativacao': 'leaky_relu', 'learning_rate': 0.011892704578252377, 'optimizer': 'rmsprop'}. Best is trial 13 with value: 0.7236846093386838.
GPU available: True (cuda), used: True
TPU available: False, using: 0 TPU cores
IPU available: False, using: 0 IPUs
HPU available: False, using: 0 HPUs
LOCAL_RANK: 0 - CUDA_VISIBLE_DEVICES: [0]

  | Name | Type       | Params
------------------------------------
0 | rede | Sequential | 346   
------------------------------------
346       Trainable params
0         Non-trainable params
346       Total params
0.001     Total estimated model params size (MB)
SLURM auto-requeueing enabled. Setting signal handlers.
`Trainer.fit` stopped: `max_epochs=50` reached.
/home/gustavo23000/anaconda3/envs/rapid/lib/python3.10/site-packages/sklearn/metrics/_regression.py:483: FutureWarning: 'squared' is deprecated in version 1.4 and will be removed in 1.6. To calculate the root mean squared error, use the function'root_mean_squared_error'.
  warnings.warn(
[I 2024-05-08 18:47:42,284] Trial 52 finished with value: 0.7266278453015667 and parameters: {'num_neuronios': 15, 'num_camadas': 2, 'ativacao': 'leaky_relu', 'learning_rate': 0.0048208171476257335, 'optimizer': 'rmsprop'}. Best is trial 13 with value: 0.7236846093386838.
GPU available: True (cuda), used: True
TPU available: False, using: 0 TPU cores
IPU available: False, using: 0 IPUs
HPU available: False, using: 0 HPUs
LOCAL_RANK: 0 - CUDA_VISIBLE_DEVICES: [0]

  | Name | Type       | Params
------------------------------------
0 | rede | Sequential | 385   
------------------------------------
385       Trainable params
0         Non-trainable params
385       Total params
0.002     Total estimated model params size (MB)
SLURM auto-requeueing enabled. Setting signal handlers.
`Trainer.fit` stopped: `max_epochs=50` reached.
/home/gustavo23000/anaconda3/envs/rapid/lib/python3.10/site-packages/sklearn/metrics/_regression.py:483: FutureWarning: 'squared' is deprecated in version 1.4 and will be removed in 1.6. To calculate the root mean squared error, use the function'root_mean_squared_error'.
  warnings.warn(
[I 2024-05-08 18:49:08,721] Trial 53 finished with value: 0.7342320322263319 and parameters: {'num_neuronios': 16, 'num_camadas': 2, 'ativacao': 'leaky_relu', 'learning_rate': 0.027494629582602813, 'optimizer': 'rmsprop'}. Best is trial 13 with value: 0.7236846093386838.
GPU available: True (cuda), used: True
TPU available: False, using: 0 TPU cores
IPU available: False, using: 0 IPUs
HPU available: False, using: 0 HPUs
LOCAL_RANK: 0 - CUDA_VISIBLE_DEVICES: [0]

  | Name | Type       | Params
------------------------------------
0 | rede | Sequential | 346   
------------------------------------
346       Trainable params
0         Non-trainable params
346       Total params
0.001     Total estimated model params size (MB)
SLURM auto-requeueing enabled. Setting signal handlers.
`Trainer.fit` stopped: `max_epochs=50` reached.
/home/gustavo23000/anaconda3/envs/rapid/lib/python3.10/site-packages/sklearn/metrics/_regression.py:483: FutureWarning: 'squared' is deprecated in version 1.4 and will be removed in 1.6. To calculate the root mean squared error, use the function'root_mean_squared_error'.
  warnings.warn(
[I 2024-05-08 18:50:34,718] Trial 54 finished with value: 0.7289313815058934 and parameters: {'num_neuronios': 15, 'num_camadas': 2, 'ativacao': 'leaky_relu', 'learning_rate': 0.001649635360933659, 'optimizer': 'rmsprop'}. Best is trial 13 with value: 0.7236846093386838.
GPU available: True (cuda), used: True
TPU available: False, using: 0 TPU cores
IPU available: False, using: 0 IPUs
HPU available: False, using: 0 HPUs
LOCAL_RANK: 0 - CUDA_VISIBLE_DEVICES: [0]

  | Name | Type       | Params
------------------------------------
0 | rede | Sequential | 385   
------------------------------------
385       Trainable params
0         Non-trainable params
385       Total params
0.002     Total estimated model params size (MB)
SLURM auto-requeueing enabled. Setting signal handlers.
`Trainer.fit` stopped: `max_epochs=50` reached.
/home/gustavo23000/anaconda3/envs/rapid/lib/python3.10/site-packages/sklearn/metrics/_regression.py:483: FutureWarning: 'squared' is deprecated in version 1.4 and will be removed in 1.6. To calculate the root mean squared error, use the function'root_mean_squared_error'.
  warnings.warn(
[I 2024-05-08 18:51:57,435] Trial 55 finished with value: 0.8900402026767228 and parameters: {'num_neuronios': 16, 'num_camadas': 2, 'ativacao': 'leaky_relu', 'learning_rate': 0.006075503416264928, 'optimizer': 'sgd'}. Best is trial 13 with value: 0.7236846093386838.
GPU available: True (cuda), used: True
TPU available: False, using: 0 TPU cores
IPU available: False, using: 0 IPUs
HPU available: False, using: 0 HPUs
LOCAL_RANK: 0 - CUDA_VISIBLE_DEVICES: [0]

  | Name | Type       | Params
------------------------------------
0 | rede | Sequential | 309   
------------------------------------
309       Trainable params
0         Non-trainable params
309       Total params
0.001     Total estimated model params size (MB)
SLURM auto-requeueing enabled. Setting signal handlers.
`Trainer.fit` stopped: `max_epochs=50` reached.
/home/gustavo23000/anaconda3/envs/rapid/lib/python3.10/site-packages/sklearn/metrics/_regression.py:483: FutureWarning: 'squared' is deprecated in version 1.4 and will be removed in 1.6. To calculate the root mean squared error, use the function'root_mean_squared_error'.
  warnings.warn(
