[I 2024-05-08 19:48:32,837] Trial 94 finished with value: 0.7274208534094773 and parameters: {'num_neuronios': 16, 'num_camadas': 2, 'ativacao': 'leaky_relu', 'learning_rate': 0.0012224728733015234, 'optimizer': 'rmsprop'}. Best is trial 13 with value: 0.7236846093386838.
GPU available: True (cuda), used: True
TPU available: False, using: 0 TPU cores
IPU available: False, using: 0 IPUs
HPU available: False, using: 0 HPUs
LOCAL_RANK: 0 - CUDA_VISIBLE_DEVICES: [0]

  | Name | Type       | Params
------------------------------------
0 | rede | Sequential | 385   
------------------------------------
385       Trainable params
0         Non-trainable params
385       Total params
0.002     Total estimated model params size (MB)
SLURM auto-requeueing enabled. Setting signal handlers.
`Trainer.fit` stopped: `max_epochs=50` reached.
/home/gustavo23000/anaconda3/envs/rapid/lib/python3.10/site-packages/sklearn/metrics/_regression.py:483: FutureWarning: 'squared' is deprecated in version 1.4 and will be removed in 1.6. To calculate the root mean squared error, use the function'root_mean_squared_error'.
  warnings.warn(
[I 2024-05-08 19:49:58,928] Trial 95 finished with value: 0.7271680395735831 and parameters: {'num_neuronios': 16, 'num_camadas': 2, 'ativacao': 'leaky_relu', 'learning_rate': 0.001557838199986166, 'optimizer': 'rmsprop'}. Best is trial 13 with value: 0.7236846093386838.
GPU available: True (cuda), used: True
TPU available: False, using: 0 TPU cores
IPU available: False, using: 0 IPUs
HPU available: False, using: 0 HPUs
LOCAL_RANK: 0 - CUDA_VISIBLE_DEVICES: [0]

  | Name | Type       | Params
------------------------------------
0 | rede | Sequential | 346   
------------------------------------
346       Trainable params
0         Non-trainable params
346       Total params
0.001     Total estimated model params size (MB)
SLURM auto-requeueing enabled. Setting signal handlers.
`Trainer.fit` stopped: `max_epochs=50` reached.
/home/gustavo23000/anaconda3/envs/rapid/lib/python3.10/site-packages/sklearn/metrics/_regression.py:483: FutureWarning: 'squared' is deprecated in version 1.4 and will be removed in 1.6. To calculate the root mean squared error, use the function'root_mean_squared_error'.
  warnings.warn(
[I 2024-05-08 19:51:24,152] Trial 96 finished with value: 0.7373840261663269 and parameters: {'num_neuronios': 15, 'num_camadas': 2, 'ativacao': 'leaky_relu', 'learning_rate': 5.979573973208763e-05, 'optimizer': 'rmsprop'}. Best is trial 13 with value: 0.7236846093386838.
GPU available: True (cuda), used: True
TPU available: False, using: 0 TPU cores
IPU available: False, using: 0 IPUs
HPU available: False, using: 0 HPUs
LOCAL_RANK: 0 - CUDA_VISIBLE_DEVICES: [0]

  | Name | Type       | Params
------------------------------------
0 | rede | Sequential | 385   
------------------------------------
385       Trainable params
0         Non-trainable params
385       Total params
0.002     Total estimated model params size (MB)
SLURM auto-requeueing enabled. Setting signal handlers.
`Trainer.fit` stopped: `max_epochs=50` reached.
/home/gustavo23000/anaconda3/envs/rapid/lib/python3.10/site-packages/sklearn/metrics/_regression.py:483: FutureWarning: 'squared' is deprecated in version 1.4 and will be removed in 1.6. To calculate the root mean squared error, use the function'root_mean_squared_error'.
  warnings.warn(
[I 2024-05-08 19:52:50,804] Trial 97 finished with value: 0.7281118623217098 and parameters: {'num_neuronios': 16, 'num_camadas': 2, 'ativacao': 'leaky_relu', 'learning_rate': 0.00101426695202285, 'optimizer': 'rmsprop'}. Best is trial 13 with value: 0.7236846093386838.
GPU available: True (cuda), used: True
TPU available: False, using: 0 TPU cores
IPU available: False, using: 0 IPUs
HPU available: False, using: 0 HPUs
LOCAL_RANK: 0 - CUDA_VISIBLE_DEVICES: [0]

  | Name | Type       | Params
------------------------------------
0 | rede | Sequential | 385   
------------------------------------
385       Trainable params
0         Non-trainable params
385       Total params
0.002     Total estimated model params size (MB)
SLURM auto-requeueing enabled. Setting signal handlers.
`Trainer.fit` stopped: `max_epochs=50` reached.
/home/gustavo23000/anaconda3/envs/rapid/lib/python3.10/site-packages/sklearn/metrics/_regression.py:483: FutureWarning: 'squared' is deprecated in version 1.4 and will be removed in 1.6. To calculate the root mean squared error, use the function'root_mean_squared_error'.
  warnings.warn(
[I 2024-05-08 19:54:17,683] Trial 98 finished with value: 0.726270327515028 and parameters: {'num_neuronios': 16, 'num_camadas': 2, 'ativacao': 'leaky_relu', 'learning_rate': 0.00207124750878568, 'optimizer': 'rmsprop'}. Best is trial 13 with value: 0.7236846093386838.
GPU available: True (cuda), used: True
TPU available: False, using: 0 TPU cores
IPU available: False, using: 0 IPUs
HPU available: False, using: 0 HPUs
LOCAL_RANK: 0 - CUDA_VISIBLE_DEVICES: [0]

  | Name | Type       | Params
------------------------------------
0 | rede | Sequential | 346   
------------------------------------
346       Trainable params
0         Non-trainable params
346       Total params
0.001     Total estimated model params size (MB)
SLURM auto-requeueing enabled. Setting signal handlers.
`Trainer.fit` stopped: `max_epochs=50` reached.
/home/gustavo23000/anaconda3/envs/rapid/lib/python3.10/site-packages/sklearn/metrics/_regression.py:483: FutureWarning: 'squared' is deprecated in version 1.4 and will be removed in 1.6. To calculate the root mean squared error, use the function'root_mean_squared_error'.
  warnings.warn(
[I 2024-05-08 19:55:42,886] Trial 99 finished with value: 0.7273062767375256 and parameters: {'num_neuronios': 15, 'num_camadas': 2, 'ativacao': 'leaky_relu', 'learning_rate': 0.005184894242240656, 'optimizer': 'rmsprop'}. Best is trial 13 with value: 0.7236846093386838.
