[I 2024-05-08 17:30:18,868] A new study created in memory with name: no-name-d600e143-a746-4e7f-9ffb-3e3be8bb640d
GPU available: True (cuda), used: True
TPU available: False, using: 0 TPU cores
IPU available: False, using: 0 IPUs
HPU available: False, using: 0 HPUs
/home/gustavo23000/anaconda3/envs/rapid/lib/python3.10/site-packages/lightning/pytorch/trainer/connectors/logger_connector/logger_connector.py:75: Starting from v1.9.0, `tensorboardX` has been removed as a dependency of the `lightning.pytorch` package, due to potential conflicts with other packages in the ML ecosystem. For this reason, `logger=True` will use `CSVLogger` as the default logger, unless the `tensorboard` or `tensorboardX` packages are found. Please `pip install lightning[extra]` or one of them to enable TensorBoard support by default
LOCAL_RANK: 0 - CUDA_VISIBLE_DEVICES: [0]

  | Name | Type       | Params
------------------------------------
0 | rede | Sequential | 397   
------------------------------------
397       Trainable params
0         Non-trainable params
397       Total params
0.002     Total estimated model params size (MB)
SLURM auto-requeueing enabled. Setting signal handlers.
`Trainer.fit` stopped: `max_epochs=50` reached.
/home/gustavo23000/anaconda3/envs/rapid/lib/python3.10/site-packages/sklearn/metrics/_regression.py:483: FutureWarning: 'squared' is deprecated in version 1.4 and will be removed in 1.6. To calculate the root mean squared error, use the function'root_mean_squared_error'.
  warnings.warn(
[I 2024-05-08 17:31:53,345] Trial 0 finished with value: 0.7314441883695154 and parameters: {'num_neuronios': 12, 'num_camadas': 3, 'ativacao': 'tanh', 'learning_rate': 0.01895488192059832, 'optimizer': 'adam'}. Best is trial 0 with value: 0.7314441883695154.
GPU available: True (cuda), used: True
TPU available: False, using: 0 TPU cores
IPU available: False, using: 0 IPUs
HPU available: False, using: 0 HPUs
LOCAL_RANK: 0 - CUDA_VISIBLE_DEVICES: [0]

  | Name | Type       | Params
------------------------------------
0 | rede | Sequential | 78    
------------------------------------
78        Trainable params
0         Non-trainable params
78        Total params
0.000     Total estimated model params size (MB)
SLURM auto-requeueing enabled. Setting signal handlers.
`Trainer.fit` stopped: `max_epochs=50` reached.
/home/gustavo23000/anaconda3/envs/rapid/lib/python3.10/site-packages/sklearn/metrics/_regression.py:483: FutureWarning: 'squared' is deprecated in version 1.4 and will be removed in 1.6. To calculate the root mean squared error, use the function'root_mean_squared_error'.
  warnings.warn(
[I 2024-05-08 17:33:15,246] Trial 1 finished with value: 0.7625253945174495 and parameters: {'num_neuronios': 11, 'num_camadas': 1, 'ativacao': 'sigmoid', 'learning_rate': 0.0004352186863719465, 'optimizer': 'rmsprop'}. Best is trial 0 with value: 0.7314441883695154.
GPU available: True (cuda), used: True
TPU available: False, using: 0 TPU cores
IPU available: False, using: 0 IPUs
HPU available: False, using: 0 HPUs
LOCAL_RANK: 0 - CUDA_VISIBLE_DEVICES: [0]

  | Name | Type       | Params
------------------------------------
0 | rede | Sequential | 29    
------------------------------------
29        Trainable params
0         Non-trainable params
29        Total params
0.000     Total estimated model params size (MB)
SLURM auto-requeueing enabled. Setting signal handlers.
`Trainer.fit` stopped: `max_epochs=50` reached.
/home/gustavo23000/anaconda3/envs/rapid/lib/python3.10/site-packages/sklearn/metrics/_regression.py:483: FutureWarning: 'squared' is deprecated in version 1.4 and will be removed in 1.6. To calculate the root mean squared error, use the function'root_mean_squared_error'.
  warnings.warn(
[I 2024-05-08 17:34:38,353] Trial 2 finished with value: 0.8990186350514431 and parameters: {'num_neuronios': 4, 'num_camadas': 1, 'ativacao': 'relu', 'learning_rate': 0.045276365758181586, 'optimizer': 'adam'}. Best is trial 0 with value: 0.7314441883695154.
GPU available: True (cuda), used: True
TPU available: False, using: 0 TPU cores
IPU available: False, using: 0 IPUs
HPU available: False, using: 0 HPUs
LOCAL_RANK: 0 - CUDA_VISIBLE_DEVICES: [0]

  | Name | Type       | Params
------------------------------------
0 | rede | Sequential | 36    
------------------------------------
36        Trainable params
0         Non-trainable params
36        Total params
0.000     Total estimated model params size (MB)
SLURM auto-requeueing enabled. Setting signal handlers.
`Trainer.fit` stopped: `max_epochs=50` reached.
/home/gustavo23000/anaconda3/envs/rapid/lib/python3.10/site-packages/sklearn/metrics/_regression.py:483: FutureWarning: 'squared' is deprecated in version 1.4 and will be removed in 1.6. To calculate the root mean squared error, use the function'root_mean_squared_error'.
  warnings.warn(
[I 2024-05-08 17:36:03,613] Trial 3 finished with value: 0.7328864134441532 and parameters: {'num_neuronios': 5, 'num_camadas': 1, 'ativacao': 'sigmoid', 'learning_rate': 0.05009384458394524, 'optimizer': 'adam'}. Best is trial 0 with value: 0.7314441883695154.
GPU available: True (cuda), used: True
TPU available: False, using: 0 TPU cores
IPU available: False, using: 0 IPUs
HPU available: False, using: 0 HPUs
LOCAL_RANK: 0 - CUDA_VISIBLE_DEVICES: [0]

  | Name | Type       | Params
------------------------------------
0 | rede | Sequential | 162   
------------------------------------
162       Trainable params
0         Non-trainable params
162       Total params
0.001     Total estimated model params size (MB)
SLURM auto-requeueing enabled. Setting signal handlers.
`Trainer.fit` stopped: `max_epochs=50` reached.
/home/gustavo23000/anaconda3/envs/rapid/lib/python3.10/site-packages/sklearn/metrics/_regression.py:483: FutureWarning: 'squared' is deprecated in version 1.4 and will be removed in 1.6. To calculate the root mean squared error, use the function'root_mean_squared_error'.
  warnings.warn(
[I 2024-05-08 17:37:33,139] Trial 4 finished with value: 0.7417675373188148 and parameters: {'num_neuronios': 7, 'num_camadas': 3, 'ativacao': 'sigmoid', 'learning_rate': 0.0004062727495278013, 'optimizer': 'adam'}. Best is trial 0 with value: 0.7314441883695154.
GPU available: True (cuda), used: True
TPU available: False, using: 0 TPU cores
IPU available: False, using: 0 IPUs
HPU available: False, using: 0 HPUs
LOCAL_RANK: 0 - CUDA_VISIBLE_DEVICES: [0]

  | Name | Type       | Params
------------------------------------
0 | rede | Sequential | 85    
------------------------------------
85        Trainable params
0         Non-trainable params
85        Total params
0.000     Total estimated model params size (MB)
SLURM auto-requeueing enabled. Setting signal handlers.
`Trainer.fit` stopped: `max_epochs=50` reached.
/home/gustavo23000/anaconda3/envs/rapid/lib/python3.10/site-packages/sklearn/metrics/_regression.py:483: FutureWarning: 'squared' is deprecated in version 1.4 and will be removed in 1.6. To calculate the root mean squared error, use the function'root_mean_squared_error'.
  warnings.warn(
[I 2024-05-08 17:38:58,653] Trial 5 finished with value: 0.7297890574412897 and parameters: {'num_neuronios': 6, 'num_camadas': 2, 'ativacao': 'sigmoid', 'learning_rate': 0.09103442325299291, 'optimizer': 'rmsprop'}. Best is trial 5 with value: 0.7297890574412897.
GPU available: True (cuda), used: True
TPU available: False, using: 0 TPU cores
IPU available: False, using: 0 IPUs
HPU available: False, using: 0 HPUs
LOCAL_RANK: 0 - CUDA_VISIBLE_DEVICES: [0]

  | Name | Type       | Params
------------------------------------
0 | rede | Sequential | 154   
------------------------------------
154       Trainable params
0         Non-trainable params
154       Total params
0.001     Total estimated model params size (MB)
SLURM auto-requeueing enabled. Setting signal handlers.
`Trainer.fit` stopped: `max_epochs=50` reached.
/home/gustavo23000/anaconda3/envs/rapid/lib/python3.10/site-packages/sklearn/metrics/_regression.py:483: FutureWarning: 'squared' is deprecated in version 1.4 and will be removed in 1.6. To calculate the root mean squared error, use the function'root_mean_squared_error'.
  warnings.warn(
[I 2024-05-08 17:40:23,561] Trial 6 finished with value: 0.8988652759198075 and parameters: {'num_neuronios': 9, 'num_camadas': 2, 'ativacao': 'leaky_relu', 'learning_rate': 0.003143782993763299, 'optimizer': 'sgd'}. Best is trial 5 with value: 0.7297890574412897.
GPU available: True (cuda), used: True
TPU available: False, using: 0 TPU cores
IPU available: False, using: 0 IPUs
HPU available: False, using: 0 HPUs
LOCAL_RANK: 0 - CUDA_VISIBLE_DEVICES: [0]

  | Name | Type       | Params
------------------------------------
0 | rede | Sequential | 78    
------------------------------------
78        Trainable params
0         Non-trainable params
78        Total params
0.000     Total estimated model params size (MB)
SLURM auto-requeueing enabled. Setting signal handlers.
`Trainer.fit` stopped: `max_epochs=50` reached.
/home/gustavo23000/anaconda3/envs/rapid/lib/python3.10/site-packages/sklearn/metrics/_regression.py:483: FutureWarning: 'squared' is deprecated in version 1.4 and will be removed in 1.6. To calculate the root mean squared error, use the function'root_mean_squared_error'.
  warnings.warn(
[I 2024-05-08 17:41:46,513] Trial 7 finished with value: 0.7617243522547403 and parameters: {'num_neuronios': 11, 'num_camadas': 1, 'ativacao': 'sigmoid', 'learning_rate': 0.00042511165704163474, 'optimizer': 'rmsprop'}. Best is trial 5 with value: 0.7297890574412897.
GPU available: True (cuda), used: True
TPU available: False, using: 0 TPU cores
IPU available: False, using: 0 IPUs
HPU available: False, using: 0 HPUs
LOCAL_RANK: 0 - CUDA_VISIBLE_DEVICES: [0]

  | Name | Type       | Params
------------------------------------
0 | rede | Sequential | 291   
------------------------------------
291       Trainable params
0         Non-trainable params
291       Total params
0.001     Total estimated model params size (MB)
SLURM auto-requeueing enabled. Setting signal handlers.
`Trainer.fit` stopped: `max_epochs=50` reached.
/home/gustavo23000/anaconda3/envs/rapid/lib/python3.10/site-packages/sklearn/metrics/_regression.py:483: FutureWarning: 'squared' is deprecated in version 1.4 and will be removed in 1.6. To calculate the root mean squared error, use the function'root_mean_squared_error'.
  warnings.warn(
[I 2024-05-08 17:43:13,030] Trial 8 finished with value: 0.7296887266249061 and parameters: {'num_neuronios': 10, 'num_camadas': 3, 'ativacao': 'sigmoid', 'learning_rate': 0.03583269250412118, 'optimizer': 'rmsprop'}. Best is trial 8 with value: 0.7296887266249061.
GPU available: True (cuda), used: True
TPU available: False, using: 0 TPU cores
IPU available: False, using: 0 IPUs
HPU available: False, using: 0 HPUs
LOCAL_RANK: 0 - CUDA_VISIBLE_DEVICES: [0]

  | Name | Type       | Params
------------------------------------
0 | rede | Sequential | 43    
------------------------------------
43        Trainable params
0         Non-trainable params
43        Total params
0.000     Total estimated model params size (MB)
SLURM auto-requeueing enabled. Setting signal handlers.
`Trainer.fit` stopped: `max_epochs=50` reached.
/home/gustavo23000/anaconda3/envs/rapid/lib/python3.10/site-packages/sklearn/metrics/_regression.py:483: FutureWarning: 'squared' is deprecated in version 1.4 and will be removed in 1.6. To calculate the root mean squared error, use the function'root_mean_squared_error'.
  warnings.warn(
[I 2024-05-08 17:44:37,492] Trial 9 finished with value: 0.7725020935165428 and parameters: {'num_neuronios': 6, 'num_camadas': 1, 'ativacao': 'relu', 'learning_rate': 0.02543069822432659, 'optimizer': 'rmsprop'}. Best is trial 8 with value: 0.7296887266249061.
GPU available: True (cuda), used: True
TPU available: False, using: 0 TPU cores
IPU available: False, using: 0 IPUs
HPU available: False, using: 0 HPUs
LOCAL_RANK: 0 - CUDA_VISIBLE_DEVICES: [0]

  | Name | Type       | Params
------------------------------------
0 | rede | Sequential | 519   
------------------------------------
519       Trainable params
0         Non-trainable params
519       Total params
0.002     Total estimated model params size (MB)
SLURM auto-requeueing enabled. Setting signal handlers.
`Trainer.fit` stopped: `max_epochs=50` reached.
/home/gustavo23000/anaconda3/envs/rapid/lib/python3.10/site-packages/sklearn/metrics/_regression.py:483: FutureWarning: 'squared' is deprecated in version 1.4 and will be removed in 1.6. To calculate the root mean squared error, use the function'root_mean_squared_error'.
  warnings.warn(
[I 2024-05-08 17:46:03,226] Trial 10 finished with value: 0.9193887015884078 and parameters: {'num_neuronios': 14, 'num_camadas': 3, 'ativacao': 'tanh', 'learning_rate': 1.997340989095565e-05, 'optimizer': 'sgd'}. Best is trial 8 with value: 0.7296887266249061.
GPU available: True (cuda), used: True
TPU available: False, using: 0 TPU cores
IPU available: False, using: 0 IPUs
HPU available: False, using: 0 HPUs
LOCAL_RANK: 0 - CUDA_VISIBLE_DEVICES: [0]

  | Name | Type       | Params
------------------------------------
0 | rede | Sequential | 129   
------------------------------------
129       Trainable params
0         Non-trainable params
129       Total params
0.001     Total estimated model params size (MB)
SLURM auto-requeueing enabled. Setting signal handlers.
`Trainer.fit` stopped: `max_epochs=50` reached.
/home/gustavo23000/anaconda3/envs/rapid/lib/python3.10/site-packages/sklearn/metrics/_regression.py:483: FutureWarning: 'squared' is deprecated in version 1.4 and will be removed in 1.6. To calculate the root mean squared error, use the function'root_mean_squared_error'.
  warnings.warn(
[I 2024-05-08 17:47:33,773] Trial 11 finished with value: 0.7338276958933296 and parameters: {'num_neuronios': 8, 'num_camadas': 2, 'ativacao': 'sigmoid', 'learning_rate': 0.0049420596845900595, 'optimizer': 'rmsprop'}. Best is trial 8 with value: 0.7296887266249061.
GPU available: True (cuda), used: True
TPU available: False, using: 0 TPU cores
IPU available: False, using: 0 IPUs
HPU available: False, using: 0 HPUs
LOCAL_RANK: 0 - CUDA_VISIBLE_DEVICES: [0]

  | Name | Type       | Params
------------------------------------
0 | rede | Sequential | 385   
------------------------------------
385       Trainable params
0         Non-trainable params
385       Total params
0.002     Total estimated model params size (MB)
SLURM auto-requeueing enabled. Setting signal handlers.
`Trainer.fit` stopped: `max_epochs=50` reached.
/home/gustavo23000/anaconda3/envs/rapid/lib/python3.10/site-packages/sklearn/metrics/_regression.py:483: FutureWarning: 'squared' is deprecated in version 1.4 and will be removed in 1.6. To calculate the root mean squared error, use the function'root_mean_squared_error'.
  warnings.warn(
[I 2024-05-08 17:49:03,179] Trial 12 finished with value: 0.7263699639114087 and parameters: {'num_neuronios': 16, 'num_camadas': 2, 'ativacao': 'leaky_relu', 'learning_rate': 0.007927845727207138, 'optimizer': 'rmsprop'}. Best is trial 12 with value: 0.7263699639114087.
GPU available: True (cuda), used: True
TPU available: False, using: 0 TPU cores
IPU available: False, using: 0 IPUs
HPU available: False, using: 0 HPUs
LOCAL_RANK: 0 - CUDA_VISIBLE_DEVICES: [0]

  | Name | Type       | Params
------------------------------------
0 | rede | Sequential | 657   
------------------------------------
657       Trainable params
0         Non-trainable params
657       Total params
0.003     Total estimated model params size (MB)
SLURM auto-requeueing enabled. Setting signal handlers.
`Trainer.fit` stopped: `max_epochs=50` reached.
/home/gustavo23000/anaconda3/envs/rapid/lib/python3.10/site-packages/sklearn/metrics/_regression.py:483: FutureWarning: 'squared' is deprecated in version 1.4 and will be removed in 1.6. To calculate the root mean squared error, use the function'root_mean_squared_error'.
  warnings.warn(
[I 2024-05-08 17:50:32,931] Trial 13 finished with value: 0.7236846093386838 and parameters: {'num_neuronios': 16, 'num_camadas': 3, 'ativacao': 'leaky_relu', 'learning_rate': 0.0061022057204075785, 'optimizer': 'rmsprop'}. Best is trial 13 with value: 0.7236846093386838.
GPU available: True (cuda), used: True
TPU available: False, using: 0 TPU cores
IPU available: False, using: 0 IPUs
HPU available: False, using: 0 HPUs
LOCAL_RANK: 0 - CUDA_VISIBLE_DEVICES: [0]

  | Name | Type       | Params
------------------------------------
0 | rede | Sequential | 385   
------------------------------------
385       Trainable params
0         Non-trainable params
385       Total params
0.002     Total estimated model params size (MB)
SLURM auto-requeueing enabled. Setting signal handlers.
`Trainer.fit` stopped: `max_epochs=50` reached.
/home/gustavo23000/anaconda3/envs/rapid/lib/python3.10/site-packages/sklearn/metrics/_regression.py:483: FutureWarning: 'squared' is deprecated in version 1.4 and will be removed in 1.6. To calculate the root mean squared error, use the function'root_mean_squared_error'.
  warnings.warn(
[I 2024-05-08 17:52:00,420] Trial 14 finished with value: 0.72817674967745 and parameters: {'num_neuronios': 16, 'num_camadas': 2, 'ativacao': 'leaky_relu', 'learning_rate': 0.004099307037867734, 'optimizer': 'rmsprop'}. Best is trial 13 with value: 0.7236846093386838.
GPU available: True (cuda), used: True
TPU available: False, using: 0 TPU cores
IPU available: False, using: 0 IPUs
HPU available: False, using: 0 HPUs
LOCAL_RANK: 0 - CUDA_VISIBLE_DEVICES: [0]

  | Name | Type       | Params
------------------------------------
0 | rede | Sequential | 385   
------------------------------------
385       Trainable params
0         Non-trainable params
385       Total params
0.002     Total estimated model params size (MB)
SLURM auto-requeueing enabled. Setting signal handlers.
`Trainer.fit` stopped: `max_epochs=50` reached.
/home/gustavo23000/anaconda3/envs/rapid/lib/python3.10/site-packages/sklearn/metrics/_regression.py:483: FutureWarning: 'squared' is deprecated in version 1.4 and will be removed in 1.6. To calculate the root mean squared error, use the function'root_mean_squared_error'.
  warnings.warn(
[I 2024-05-08 17:53:29,030] Trial 15 finished with value: 0.7272158012872061 and parameters: {'num_neuronios': 16, 'num_camadas': 2, 'ativacao': 'leaky_relu', 'learning_rate': 0.0017028155338143008, 'optimizer': 'rmsprop'}. Best is trial 13 with value: 0.7236846093386838.
GPU available: True (cuda), used: True
TPU available: False, using: 0 TPU cores
IPU available: False, using: 0 IPUs
HPU available: False, using: 0 HPUs
LOCAL_RANK: 0 - CUDA_VISIBLE_DEVICES: [0]

  | Name | Type       | Params
------------------------------------
0 | rede | Sequential | 519   
------------------------------------
519       Trainable params
0         Non-trainable params
519       Total params
0.002     Total estimated model params size (MB)
SLURM auto-requeueing enabled. Setting signal handlers.
`Trainer.fit` stopped: `max_epochs=50` reached.
/home/gustavo23000/anaconda3/envs/rapid/lib/python3.10/site-packages/sklearn/metrics/_regression.py:483: FutureWarning: 'squared' is deprecated in version 1.4 and will be removed in 1.6. To calculate the root mean squared error, use the function'root_mean_squared_error'.
  warnings.warn(
[I 2024-05-08 17:54:57,168] Trial 16 finished with value: 0.8956381602958187 and parameters: {'num_neuronios': 14, 'num_camadas': 3, 'ativacao': 'leaky_relu', 'learning_rate': 0.007626954089457036, 'optimizer': 'sgd'}. Best is trial 13 with value: 0.7236846093386838.
GPU available: True (cuda), used: True
TPU available: False, using: 0 TPU cores
IPU available: False, using: 0 IPUs
HPU available: False, using: 0 HPUs
LOCAL_RANK: 0 - CUDA_VISIBLE_DEVICES: [0]

  | Name | Type       | Params
------------------------------------
0 | rede | Sequential | 309   
------------------------------------
309       Trainable params
0         Non-trainable params
309       Total params
0.001     Total estimated model params size (MB)
SLURM auto-requeueing enabled. Setting signal handlers.
`Trainer.fit` stopped: `max_epochs=50` reached.
/home/gustavo23000/anaconda3/envs/rapid/lib/python3.10/site-packages/sklearn/metrics/_regression.py:483: FutureWarning: 'squared' is deprecated in version 1.4 and will be removed in 1.6. To calculate the root mean squared error, use the function'root_mean_squared_error'.
  warnings.warn(
[I 2024-05-08 17:56:22,725] Trial 17 finished with value: 0.749196373683548 and parameters: {'num_neuronios': 14, 'num_camadas': 2, 'ativacao': 'leaky_relu', 'learning_rate': 6.799937516705217e-05, 'optimizer': 'rmsprop'}. Best is trial 13 with value: 0.7236846093386838.
GPU available: True (cuda), used: True
TPU available: False, using: 0 TPU cores
IPU available: False, using: 0 IPUs
HPU available: False, using: 0 HPUs
LOCAL_RANK: 0 - CUDA_VISIBLE_DEVICES: [0]

  | Name | Type       | Params
------------------------------------
0 | rede | Sequential | 456   
------------------------------------
456       Trainable params
0         Non-trainable params
456       Total params
0.002     Total estimated model params size (MB)
SLURM auto-requeueing enabled. Setting signal handlers.
`Trainer.fit` stopped: `max_epochs=50` reached.
/home/gustavo23000/anaconda3/envs/rapid/lib/python3.10/site-packages/sklearn/metrics/_regression.py:483: FutureWarning: 'squared' is deprecated in version 1.4 and will be removed in 1.6. To calculate the root mean squared error, use the function'root_mean_squared_error'.
  warnings.warn(
